{
  "$schema": "../schema/idea.schema.json",
  "id": "phone-app-suite",
  "type": "idea",
  "title": "Phone app suite — the specific things living on the personal comm device",
  "status": "in-progress",
  "domains": ["ui", "mechanics", "narrative", "visual", "audio"],
  "summary": "The confirmed list of apps/functions on the personal communication device: attack alert (staggered per-player delay), Claimant field guide auto-filled by Recall Knowledge, a bulletin board that quietly tracks NPC pilot attrition, contact list as the correspondence-system entry point, an occasionally-true fortune app, a between-sessions pet/plant, and an optional alternate roll interface.",
  "description": "The device itself (hardware, OS look, intranet, hacking access, mass-mailing broadcast) is captured in terminal-login-landing-page; this entry is the contents — the specific apps, each confirmed by the user in one pass ('I love all of them'). Several of these are deliberately double-duty: they're diegetic phone features AND automatic bookkeeping, so campaign state that currently has nowhere to live on-screen gets a home and stops depending on the GM remembering to say it out loud.\n\n**1. Attack alert / Contact klaxon — with staggered notification delay.** The phone is how a character learns a Contact is happening. The key mechanic, called out by the user as the best part: a **few seconds of delay between different players being alerted**, so the table doesn't learn simultaneously. Models real communication infrastructure (priority tiers, who's on duty, network propagation) and produces a genuine scramble instead of a clean simultaneous cut to action. Pairs naturally with the Contact Pool's procedural day structure.\n\n**2. Claimant field guide.** An in-phone bestiary that fills itself in automatically from successful Recall Knowledge checks, turning a spoken-once-and-forgotten fact into a permanent browsable entry. Direct concrete payoff for automated-recall-knowledge-system, which currently has an open sub-question about how reveals surface at the table — this answers it.\n\n**3 and 4.** *(Cut 2026-09-20: a Resonance ticker and Bleed-driven UI corruption, both built on systems that were cut. Removed from this entry 2026-09-25.)*\n\n**5. Bulletin board that quietly gets sadder.** A noticeboard app that updates itself as NPC pilots are lost across the campaign, with no announcement — players just notice next time they check. Direct support for the supporting-cast attrition arc in campaign-arc.md, and a better fit for the campaign's stated 'dire, not utopian' trajectory than a GM voice-over would be.\n\n**6. Contact list as the correspondence UI.** Chunky pixel-art contact cards (portrait, faction badge, one-line personality blurb) are the entry point into the dialogue-tree correspondence system — tap a contact, get their branches. Makes in-universe-correspondence-negotiation-system feel like a real interface rather than a hidden menu, and pairs with the comms-alert light on the portrait frames (in-scene-character-portrait-frames) as the notification half of the same loop.\n\n**7. Fortune app that's occasionally, quietly true.** Campy daily-horoscope flavor most of the time; sometimes a real hint or small mechanical nudge buried in it. Fits the setting's magic-and-fey layer — in a Golarion-derived world, fortune-telling can be a real service rather than only a joke.\n\n**8. A tiny pet or plant tended between sessions.** Purely textural, zero mechanical weight, maximum cute; reacts to how the last session went. Deliberate found-family / small-joys-against-a-grim-world payoff, cheap to build.\n\n**9. Alternate roll interface.** The phone can optionally serve as a second way to make character rolls, for players who prefer it over the control bar (in-scene-ui-panel-mimetic-controls) or the standard sheet. Explicitly an alternative, not a replacement — the same action available through more than one surface.",
  "capturedDate": "2026-08-22",
  "lastTouchedDate": "2026-09-06",
  "sourceContext": "Claude brainstorm at the user's request ('tell me some fun ideas you've had around the personal communication device'), all confirmed by the user in one pass, plus the attack-alert idea contributed by the user in the same message.",
  "openSubQuestions": [
    "Exact staggered-alert timing and what determines who gets alerted first — duty roster, rank, proximity, random? Not decided.",
    "Whether the fortune app's 'real hint' rate is GM-authored per session or driven by something procedural.",
    "Which apps are v1 versus later — none of these are prioritized against each other yet, and the list is long enough that building all of them before anything ships would be a mistake.",
    "How much of this can be authored as data (per-app JSON) versus needing bespoke code per app — a data-driven app framework would make the long tail far cheaper, but isn't designed."
  ],
  "relatedRefs": [
    "terminal-login-landing-page",
    "in-scene-character-portrait-frames",
    "in-scene-ui-panel-mimetic-controls",
    "in-universe-correspondence-negotiation-system",
    "automated-recall-knowledge-system",
    "watcher-reads-all-comms",
    "design/campaign-arc.md#supporting-cast-arc",
    "data/campaign/config.json"
  ],
  "resolution": "PASS 1 (2026-09-05): framework + all eight original app pages as a small draggable phone with a pixel-art OS screen, per terminal-login-landing-page's then-locked art direction. PASS 2 (2026-09-06), a genuine rebuild after live review: the user judged the small floating window itself as 'very modern' (the generic app-mockup form factor, independent of styling) and separately decided against the pixel OS. Rebuilt as design/ui/phone.js: a large panel (.bi-terminal) that rises from the chassis floor and fills 80% of the scene on open, rendered in this project's own established GLASS register (Chakra Petch/Oxanium/Share Tech Mono) instead of a pixel font, with the one deliberate exception that a genuine document (the Medical Report) renders in PAPER (reusing .bi-doc/.bi-stamp/.bi-form-row) because that is what the two-register rule already says a document should do regardless of what screen shows it. Content changed too, per new direction: real two-pane Messaging (channels + DMs, live send) and Email (inbox + reader) apps replace the old single Contacts stub; a Media Organiser (image/document grid + viewer, reusing the six marker-card location photos) answers terminal-login-landing-page's 'organised, browsable discovered material' requirement directly; a real Snake minigame (pure grid logic in phone.mjs, tested — movement, wall/self collision, food/growth/score — in test/tier1-phone.test.mjs); Pet is KEPT per explicit instruction, redrawn as a small hand-drawn SVG creature in the main dome's own HUD-SVG idiom instead of a pixel sprite; a mocked Medical Report stands in for the eventual real character sheet, using the user's own 'school grades as the ability-boost onboarding conceit' idea, explicitly labelled a template/sample, not tied to any real candidate. Alert/Field-Guide/Resonance/Bulletin/Fortune/Roll from pass 1 were NOT carried into the rebuild (superseded by the new, more specific app list) except where their pure logic in phone.mjs was cheap to keep for later. Still not built: the real correspondence-tree UI, the hacking-gated intranet, live campaign-state wiring, Foundry integration, and the mentioned-but-deferred 'condensed' companion view for messaging without the full 80% panel. Left at in-progress."
}
